{
 "schemaVersion": 1,
 "meta": {
  "trackId": "fixture-bad",
  "source": "file",
  "sourceRef": null,
  "durationSec": 263.407,
  "analyzedAt": "2026-10-28T00:00:00Z",
  "analyzerVersion": "legacy-converted"
 },
 "key": {
  "tonic": "D",
  "mode": "major",
  "confidence": 0.0
 },
 "bpm": 136.1,
 "timeSignature": {
  "numerator": 4,
  "denominator": 4
 },
 "beats": [
  {
   "t": 0.337,
   "downbeat": true
  },
  {
   "t": 0.789,
   "downbeat": false
  },
  {
   "t": 1.242,
   "downbeat": false
  },
  {
   "t": 1.672,
   "downbeat": false
  },
  {
   "t": 2.101,
   "downbeat": true
  },
  {
   "t": 2.531,
   "downbeat": false
  },
  {
   "t": 2.972,
   "downbeat": false
  },
  {
   "t": 3.425,
   "downbeat": false
  },
  {
   "t": 3.855,
   "downbeat": true
  },
  {
   "t": 4.307,
   "downbeat": false
  },
  {
   "t": 4.748,
   "downbeat": false
  },
  {
   "t": 5.201,
   "downbeat": false
  },
  {
   "t": 5.642,
   "downbeat": true
  },
  {
   "t": 6.084,
   "downbeat": false
  },
  {
   "t": 6.513,
   "downbeat": false
  },
  {
   "t": 6.966,
   "downbeat": false
  },
  {
   "t": 7.396,
   "downbeat": true
  },
  {
   "t": 7.848,
   "downbeat": false
  },
  {
   "t": 8.278,
   "downbeat": false
  },
  {
   "t": 8.719,
   "downbeat": false
  },
  {
   "t": 9.16,
   "downbeat": true
  },
  {
   "t": 9.601,
   "downbeat": false
  },
  {
   "t": 10.043,
   "downbeat": false
  },
  {
   "t": 10.495,
   "downbeat": false
  },
  {
   "t": 10.913,
   "downbeat": true
  },
  {
   "t": 11.343,
   "downbeat": false
  },
  {
   "t": 11.807,
   "downbeat": false
  },
  {
   "t": 12.26,
   "downbeat": false
  },
  {
   "t": 12.69,
   "downbeat": true
  },
  {
   "t": 13.131,
   "downbeat": false
  },
  {
   "t": 13.56,
   "downbeat": false
  },
  {
   "t": 14.002,
   "downbeat": false
  },
  {
   "t": 14.443,
   "downbeat": true
  },
  {
   "t": 14.884,
   "downbeat": false
  },
  {
   "t": 15.325,
   "downbeat": false
  },
  {
   "t": 15.778,
   "downbeat": false
  },
  {
   "t": 16.219,
   "downbeat": true
  },
  {
   "t": 16.66,
   "downbeat": false
  },
  {
   "t": 17.101,
   "downbeat": false
  },
  {
   "t": 17.554,
   "downbeat": false
  },
  {
   "t": 17.984,
   "downbeat": true
  },
  {
   "t": 18.425,
   "downbeat": false
  },
  {
   "t": 18.855,
   "downbeat": false
  },
  {
   "t": 19.319,
   "downbeat": false
  },
  {
   "t": 19.76,
   "downbeat": true
  },
  {
   "t": 20.201,
   "downbeat": false
  },
  {
   "t": 20.631,
   "downbeat": false
  },
  {
   "t": 21.072,
   "downbeat": false
  },
  {
   "t": 21.513,
   "downbeat": true
  },
  {
   "t": 21.954,
   "downbeat": false
  },
  {
   "t": 22.407,
   "downbeat": false
  },
  {
   "t": 22.837,
   "downbeat": false
  },
  {
   "t": 23.278,
   "downbeat": true
  },
  {
   "t": 23.731,
   "downbeat": false
  },
  {
   "t": 24.16,
   "downbeat": false
  },
  {
   "t": 24.613,
   "downbeat": false
  },
  {
   "t": 25.054,
   "downbeat": true
  },
  {
   "t": 25.484,
   "downbeat": false
  },
  {
   "t": 25.925,
   "downbeat": false
  },
  {
   "t": 26.378,
   "downbeat": false
  },
  {
   "t": 26.819,
   "downbeat": true
  },
  {
   "t": 27.249,
   "downbeat": false
  },
  {
   "t": 27.69,
   "downbeat": false
  },
  {
   "t": 28.154,
   "downbeat": false
  },
  {
   "t": 28.584,
   "downbeat": true
  },
  {
   "t": 29.025,
   "downbeat": false
  },
  {
   "t": 29.466,
   "downbeat": false
  },
  {
   "t": 29.907,
   "downbeat": false
  },
  {
   "t": 30.348,
   "downbeat": true
  },
  {
   "t": 30.79,
   "downbeat": false
  },
  {
   "t": 31.231,
   "downbeat": false
  },
  {
   "t": 31.672,
   "downbeat": false
  },
  {
   "t": 32.102,
   "downbeat": true
  },
  {
   "t": 32.554,
   "downbeat": false
  },
  {
   "t": 32.984,
   "downbeat": false
  },
  {
   "t": 33.437,
   "downbeat": false
  },
  {
   "t": 33.878,
   "downbeat": true
  },
  {
   "t": 34.319,
   "downbeat": false
  },
  {
   "t": 34.76,
   "downbeat": false
  },
  {
   "t": 35.213,
   "downbeat": false
  },
  {
   "t": 35.631,
   "downbeat": true
  },
  {
   "t": 36.084,
   "downbeat": false
  },
  {
   "t": 36.513,
   "downbeat": false
  },
  {
   "t": 36.966,
   "downbeat": false
  },
  {
   "t": 37.396,
   "downbeat": true
  },
  {
   "t": 37.79,
   "downbeat": false
  },
  {
   "t": 38.278,
   "downbeat": false
  },
  {
   "t": 38.742,
   "downbeat": false
  },
  {
   "t": 39.172,
   "downbeat": true
  },
  {
   "t": 39.613,
   "downbeat": false
  },
  {
   "t": 40.043,
   "downbeat": false
  },
  {
   "t": 40.507,
   "downbeat": false
  },
  {
   "t": 40.937,
   "downbeat": true
  },
  {
   "t": 41.378,
   "downbeat": false
  },
  {
   "t": 41.808,
   "downbeat": false
  },
  {
   "t": 42.26,
   "downbeat": false
  },
  {
   "t": 42.678,
   "downbeat": true
  },
  {
   "t": 43.131,
   "downbeat": false
  },
  {
   "t": 43.584,
   "downbeat": false
  },
  {
   "t": 44.037,
   "downbeat": false
  },
  {
   "t": 44.466,
   "downbeat": true
  },
  {
   "t": 44.907,
   "downbeat": false
  },
  {
   "t": 45.337,
   "downbeat": false
  },
  {
   "t": 45.79,
   "downbeat": false
  },
  {
   "t": 46.208,
   "downbeat": true
  },
  {
   "t": 46.66,
   "downbeat": false
  },
  {
   "t": 47.113,
   "downbeat": false
  },
  {
   "t": 47.566,
   "downbeat": false
  },
  {
   "t": 47.984,
   "downbeat": true
  },
  {
   "t": 48.39,
   "downbeat": false
  },
  {
   "t": 48.855,
   "downbeat": false
  },
  {
   "t": 49.319,
   "downbeat": false
  },
  {
   "t": 49.749,
   "downbeat": true
  },
  {
   "t": 50.202,
   "downbeat": false
  },
  {
   "t": 50.643,
   "downbeat": false
  },
  {
   "t": 51.096,
   "downbeat": false
  },
  {
   "t": 51.525,
   "downbeat": true
  },
  {
   "t": 51.955,
   "downbeat": false
  },
  {
   "t": 52.396,
   "downbeat": false
  },
  {
   "t": 52.849,
   "downbeat": false
  },
  {
   "t": 53.278,
   "downbeat": true
  },
  {
   "t": 53.719,
   "downbeat": false
  },
  {
   "t": 54.161,
   "downbeat": false
  },
  {
   "t": 54.613,
   "downbeat": false
  },
  {
   "t": 55.055,
   "downbeat": true
  },
  {
   "t": 55.496,
   "downbeat": false
  },
  {
   "t": 55.925,
   "downbeat": false
  },
  {
   "t": 56.378,
   "downbeat": false
  },
  {
   "t": 56.808,
   "downbeat": true
  },
  {
   "t": 57.249,
   "downbeat": false
  },
  {
   "t": 57.69,
   "downbeat": false
  },
  {
   "t": 58.131,
   "downbeat": false
  },
  {
   "t": 58.572,
   "downbeat": true
  },
  {
   "t": 59.025,
   "downbeat": false
  },
  {
   "t": 59.455,
   "downbeat": false
  },
  {
   "t": 59.873,
   "downbeat": false
  },
  {
   "t": 60.325,
   "downbeat": true
  },
  {
   "t": 60.79,
   "downbeat": false
  },
  {
   "t": 61.231,
   "downbeat": false
  },
  {
   "t": 61.672,
   "downbeat": false
  },
  {
   "t": 62.113,
   "downbeat": true
  },
  {
   "t": 62.543,
   "downbeat": false
  },
  {
   "t": 62.984,
   "downbeat": false
  },
  {
   "t": 63.449,
   "downbeat": false
  },
  {
   "t": 63.878,
   "downbeat": true
  },
  {
   "t": 64.319,
   "downbeat": false
  },
  {
   "t": 64.749,
   "downbeat": false
  },
  {
   "t": 65.19,
   "downbeat": false
  },
  {
   "t": 65.643,
   "downbeat": true
  },
  {
   "t": 66.084,
   "downbeat": false
  },
  {
   "t": 66.514,
   "downbeat": false
  },
  {
   "t": 66.932,
   "downbeat": false
  },
  {
   "t": 67.396,
   "downbeat": true
  },
  {
   "t": 67.837,
   "downbeat": false
  },
  {
   "t": 68.278,
   "downbeat": false
  },
  {
   "t": 68.731,
   "downbeat": false
  },
  {
   "t": 69.161,
   "downbeat": true
  },
  {
   "t": 69.59,
   "downbeat": false
  },
  {
   "t": 70.031,
   "downbeat": false
  },
  {
   "t": 70.473,
   "downbeat": false
  },
  {
   "t": 70.914,
   "downbeat": true
  },
  {
   "t": 71.367,
   "downbeat": false
  },
  {
   "t": 71.808,
   "downbeat": false
  },
  {
   "t": 72.26,
   "downbeat": false
  },
  {
   "t": 72.702,
   "downbeat": true
  },
  {
   "t": 73.143,
   "downbeat": false
  },
  {
   "t": 73.572,
   "downbeat": false
  },
  {
   "t": 73.979,
   "downbeat": false
  },
  {
   "t": 74.455,
   "downbeat": true
  },
  {
   "t": 74.896,
   "downbeat": false
  },
  {
   "t": 75.349,
   "downbeat": false
  },
  {
   "t": 75.79,
   "downbeat": false
  },
  {
   "t": 76.22,
   "downbeat": true
  },
  {
   "t": 76.672,
   "downbeat": false
  },
  {
   "t": 77.102,
   "downbeat": false
  },
  {
   "t": 77.566,
   "downbeat": false
  },
  {
   "t": 77.996,
   "downbeat": true
  },
  {
   "t": 78.437,
   "downbeat": false
  },
  {
   "t": 78.878,
   "downbeat": false
  },
  {
   "t": 79.308,
   "downbeat": false
  },
  {
   "t": 79.772,
   "downbeat": true
  },
  {
   "t": 80.202,
   "downbeat": false
  },
  {
   "t": 80.631,
   "downbeat": false
  },
  {
   "t": 81.072,
   "downbeat": false
  },
  {
   "t": 81.514,
   "downbeat": true
  },
  {
   "t": 81.955,
   "downbeat": false
  },
  {
   "t": 82.396,
   "downbeat": false
  },
  {
   "t": 82.837,
   "downbeat": false
  },
  {
   "t": 83.278,
   "downbeat": true
  },
  {
   "t": 83.685,
   "downbeat": false
  },
  {
   "t": 84.161,
   "downbeat": false
  },
  {
   "t": 84.625,
   "downbeat": false
  },
  {
   "t": 85.055,
   "downbeat": true
  },
  {
   "t": 85.496,
   "downbeat": false
  },
  {
   "t": 85.949,
   "downbeat": false
  },
  {
   "t": 86.378,
   "downbeat": false
  },
  {
   "t": 86.808,
   "downbeat": true
  },
  {
   "t": 87.249,
   "downbeat": false
  },
  {
   "t": 87.679,
   "downbeat": false
  },
  {
   "t": 88.143,
   "downbeat": false
  },
  {
   "t": 88.573,
   "downbeat": true
  },
  {
   "t": 89.025,
   "downbeat": false
  },
  {
   "t": 89.455,
   "downbeat": false
  },
  {
   "t": 89.908,
   "downbeat": false
  },
  {
   "t": 90.337,
   "downbeat": true
  },
  {
   "t": 90.802,
   "downbeat": false
  },
  {
   "t": 91.231,
   "downbeat": false
  },
  {
   "t": 91.672,
   "downbeat": false
  },
  {
   "t": 92.114,
   "downbeat": true
  },
  {
   "t": 92.555,
   "downbeat": false
  },
  {
   "t": 92.984,
   "downbeat": false
  },
  {
   "t": 93.425,